{
  "schema_version": "1.0.0",
  "title": "A-016 渲染样式与模板结构切分 — spec 锁定字段清单 / demo 锁定样式清单 / 越界检查清单",
  "decision_ref": "spec.md §Decision 6.3",
  "adr_ref": [
    "docs/adr/0006-shared-skeleton-scale-slice.md",
    "docs/adr/0007-ten-demo-paths.md"
  ],
  "ledger_ref": "decision-ledger.md A-016",
  "blocked_by": "#14, #15",
  "upstream_contract": [
    "reports/14-skeleton-fields.json",
    "reports/15-slice-boundaries.json"
  ],
  "mental_model": "spec 文档 = 语义 HTML（只表达结构与字段语义）；demo = CSS + 设计令牌；越界 = 在 spec 里出现了 CSS。",
  "layer_split": {
    "spec": {
      "locks": [
        "章节集合与章顺序（继承 A-014）",
        "字段名 / 类型 / 必填 / 语义描述",
        "切片字段命名空间（继承 A-015 R1-R7）"
      ],
      "forbidden": [
        "任何样式声明",
        "任何 UI 元素",
        "任何呈现措辞"
      ]
    },
    "demo": {
      "locks": [
        "渲染样式 token（颜色/字号/间距/徽标/横幅）",
        "主题模式与排版",
        "样式值到 token 的绑定"
      ],
      "inherits": [
        "spec 锁定的全部字段（必须全部渲染或显式标注 skip_reason）"
      ]
    }
  },
  "spec_locked_fields": [
    {
      "name": "report_id",
      "type": "string",
      "required": true,
      "layer": "spec",
      "kind": "structure",
      "container": "C1 执行摘要",
      "description": "报告唯一标识，写入 fact table，作为跨 scale 聚合主键之一",
      "origin": "A-014:reports/14-skeleton-fields.json#C1"
    },
    {
      "name": "schema_version",
      "type": "string(semver)",
      "required": true,
      "layer": "spec",
      "kind": "structure",
      "container": "C1 执行摘要",
      "description": "本骨架契约版本，与 14-skeleton.schema.json 对齐",
      "origin": "A-014:reports/14-skeleton-fields.json#C1"
    },
    {
      "name": "scale",
      "type": "enum[MACRO-A|MACRO-B|MACRO-C|MICRO-A|MICRO-B]",
      "required": true,
      "layer": "spec",
      "kind": "structure",
      "container": "C1 执行摘要",
      "description": "审计粒度档位（ADR-0001 五档）",
      "origin": "A-014:reports/14-skeleton-fields.json#C1"
    },
    {
      "name": "subject_ref",
      "type": "string",
      "required": true,
      "layer": "spec",
      "kind": "structure",
      "container": "C1 执行摘要",
      "description": "审计对象定位符：repo@sha / PR# / 文件路径:行",
      "origin": "A-014:reports/14-skeleton-fields.json#C1"
    },
    {
      "name": "generated_at",
      "type": "string(date-time)",
      "required": true,
      "layer": "spec",
      "kind": "structure",
      "container": "C1 执行摘要",
      "description": "报告生成时刻，ISO 8601 UTC",
      "origin": "A-014:reports/14-skeleton-fields.json#C1"
    },
    {
      "name": "correlation_key",
      "type": "string(32)",
      "required": true,
      "layer": "spec",
      "kind": "structure",
      "container": "C1 执行摘要",
      "description": "trace_id/baggage_id（A-010），用于跨 scale 关联同一 commit/PR 的审计记录",
      "origin": "A-014:reports/14-skeleton-fields.json#C1"
    },
    {
      "name": "overall_verdict",
      "type": "enum[pass|warn|fail|insufficient]",
      "required": true,
      "layer": "spec",
      "kind": "structure",
      "container": "C1 执行摘要",
      "description": "综合裁决；insufficient 表示信号不足（对齐 S5 单人仓降权门语义）",
      "origin": "A-014:reports/14-skeleton-fields.json#C1"
    },
    {
      "name": "confidence",
      "type": "number(0-1)",
      "required": true,
      "layer": "spec",
      "kind": "structure",
      "container": "C1 执行摘要",
      "description": "裁决置信度；低于协议阈值时 overall_verdict 必须为 insufficient",
      "origin": "A-014:reports/14-skeleton-fields.json#C1"
    },
    {
      "name": "headline",
      "type": "string",
      "required": true,
      "layer": "spec",
      "kind": "structure",
      "container": "C1 执行摘要",
      "description": "一句话结论（措辞不锁，长度上限 200 字符）",
      "origin": "A-014:reports/14-skeleton-fields.json#C1"
    },
    {
      "name": "top_findings",
      "type": "array[string]",
      "required": true,
      "layer": "spec",
      "kind": "structure",
      "container": "C1 执行摘要",
      "description": "指向 C3 证据条目的 evidence_id，至少 1 项",
      "origin": "A-014:reports/14-skeleton-fields.json#C1"
    },
    {
      "name": "degraded_mode",
      "type": "boolean",
      "required": true,
      "layer": "spec",
      "kind": "structure",
      "container": "C1 执行摘要",
      "description": "是否处于降级产出；true 时走 A-018 failure path 语义并必带降级说明",
      "origin": "A-014:reports/14-skeleton-fields.json#C1"
    },
    {
      "name": "stale_data_marker",
      "type": "enum[fresh|warn|stale|unknown]",
      "required": true,
      "layer": "spec",
      "kind": "structure",
      "container": "C1 执行摘要",
      "description": "陈旧数据标记本体（A-009）；fresh=投影延迟 ≤ SLA，warn=超 warn 阈值，stale=超 error 阈值或投影停滞，unknown=探测失败（fail-closed）",
      "origin": "A-014:reports/14-skeleton-fields.json#C1"
    },
    {
      "name": "staleness_sla_seconds",
      "type": "number",
      "required": true,
      "layer": "spec",
      "kind": "structure",
      "container": "C1 执行摘要",
      "description": "本次报告生效的陈旧读 SLA（数字，秒；按 scale 取自 A-009 per_scale 表，默认 5）",
      "origin": "A-014:reports/14-skeleton-fields.json#C1"
    },
    {
      "name": "read_model_lag_seconds",
      "type": "number",
      "required": true,
      "layer": "spec",
      "kind": "structure",
      "container": "C1 执行摘要",
      "description": "实测投影延迟（秒）= now - fact 表 MAX(recorded_at)；字段名与 A-012 metric 逐字对齐",
      "origin": "A-014:reports/14-skeleton-fields.json#C1"
    },
    {
      "name": "read_model_version",
      "type": "integer",
      "required": true,
      "layer": "spec",
      "kind": "structure",
      "container": "C1 执行摘要",
      "description": "该 read model 已投影到的 fact 版本（控制表 read_model_state.last_processed_version）",
      "origin": "A-014:reports/14-skeleton-fields.json#C1"
    },
    {
      "name": "fact_watermark_version",
      "type": "integer",
      "required": true,
      "layer": "spec",
      "kind": "structure",
      "container": "C1 执行摘要",
      "description": "fact 表最新水位版本 = MAX(fact.version)",
      "origin": "A-014:reports/14-skeleton-fields.json#C1"
    },
    {
      "name": "quadrants",
      "type": "array[QuadrantBlock](4)",
      "required": true,
      "layer": "spec",
      "kind": "structure",
      "container": "C2 四象限与裁决",
      "description": "恰好 4 项，顺序锁定：structure → behavior → supply_chain → strategy",
      "origin": "A-014:reports/14-skeleton-fields.json#C2"
    },
    {
      "name": "quadrant",
      "type": "enum[structure|behavior|supply_chain|strategy]",
      "required": true,
      "layer": "spec",
      "kind": "structure",
      "container": "C2 四象限与裁决",
      "description": "象限标识（ADR-0001 四象限）",
      "origin": "A-014:reports/14-skeleton-fields.json#C2"
    },
    {
      "name": "applicability",
      "type": "enum[native|projected|not_applicable]",
      "required": true,
      "layer": "spec",
      "kind": "structure",
      "container": "C2 四象限与裁决",
      "description": "该象限在本 scale 的适用形态；native=原生有效，projected=由其他 scale 投影/聚合推得，not_applicable=无信号",
      "origin": "A-014:reports/14-skeleton-fields.json#C2"
    },
    {
      "name": "verdict",
      "type": "enum[pass|warn|fail|insufficient]|null",
      "required": true,
      "layer": "spec",
      "kind": "structure",
      "container": "C2 四象限与裁决",
      "description": "象限裁决；applicability=not_applicable 时必须为 null",
      "origin": "A-014:reports/14-skeleton-fields.json#C2"
    },
    {
      "name": "score",
      "type": "number|null",
      "required": true,
      "layer": "spec",
      "kind": "structure",
      "container": "C2 四象限与裁决",
      "description": "象限评分；为 null 时必须配合 verdict=insufficient",
      "origin": "A-014:reports/14-skeleton-fields.json#C2"
    },
    {
      "name": "confidence",
      "type": "number|null",
      "required": true,
      "layer": "spec",
      "kind": "structure",
      "container": "C2 四象限与裁决",
      "description": "象限置信度",
      "origin": "A-014:reports/14-skeleton-fields.json#C2"
    },
    {
      "name": "dimensions",
      "type": "array[DimensionRef]",
      "required": true,
      "layer": "spec",
      "kind": "structure",
      "container": "C2 四象限与裁决",
      "description": "关联维度引用；strategy 象限为 S1-S5（指向 #05 25 格矩阵），其余象限可空数组",
      "origin": "A-014:reports/14-skeleton-fields.json#C2"
    },
    {
      "name": "slice_fields",
      "type": "object",
      "required": true,
      "layer": "spec",
      "kind": "structure",
      "container": "C2 四象限与裁决",
      "description": "该 (scale, quadrant) 交集字段实例，键集由本文件 cells 表严格锁定",
      "origin": "A-014:reports/14-skeleton-fields.json#C2"
    },
    {
      "name": "verdict_gate.protocol_version",
      "type": "string",
      "required": true,
      "layer": "spec",
      "kind": "structure",
      "container": "C2 四象限与裁决",
      "description": "Adjudication Protocol 版本（code-as-policy，ADR-0005）",
      "origin": "A-014:reports/14-skeleton-fields.json#C2"
    },
    {
      "name": "verdict_gate.decision",
      "type": "enum[accepted|rejected|overridden|insufficient]",
      "required": true,
      "layer": "spec",
      "kind": "structure",
      "container": "C2 四象限与裁决",
      "description": "裁决结果",
      "origin": "A-014:reports/14-skeleton-fields.json#C2"
    },
    {
      "name": "verdict_gate.evidence_threshold_met",
      "type": "boolean",
      "required": true,
      "layer": "spec",
      "kind": "structure",
      "container": "C2 四象限与裁决",
      "description": "是否达到证据门槛",
      "origin": "A-014:reports/14-skeleton-fields.json#C2"
    },
    {
      "name": "verdict_gate.decided_at",
      "type": "string(date-time)",
      "required": true,
      "layer": "spec",
      "kind": "structure",
      "container": "C2 四象限与裁决",
      "description": "裁决时刻",
      "origin": "A-014:reports/14-skeleton-fields.json#C2"
    },
    {
      "name": "verdict_gate.override_reason",
      "type": "string|null",
      "required": true,
      "layer": "spec",
      "kind": "structure",
      "container": "C2 四象限与裁决",
      "description": "非 overridden 时必须为 null",
      "origin": "A-014:reports/14-skeleton-fields.json#C2"
    },
    {